Good?, flags, VID, PID, Name, INIid, REGid, RegEntry, INIguid, REGguid, HIDguid, ValsOK?, ReadsOk?

,,, HIDscanning completed

N, x00, x1234, xBEAD, , -1, -1, 0, {NULL}, {NULL}, {A5D8DC70-8DD7-11EB-8002-444553540000}, Y, N

,,, REGscanning completed

N, x00, x1234, xBEAD, vJoy Device, -1, 0, 0, {NULL}, {A5D8DC70-8DD7-11EB-8002-444553540000}, {A5D8DC70-8DD7-11EB-8002-444553540000}, Y, Y

,,, User settings imported

N, x00, x1234, xBEAD, vJoy Device, -1, 0, 0, {NULL}, {A5D8DC70-8DD7-11EB-8002-444553540000}, {A5D8DC70-8DD7-11EB-8002-444553540000}, Y, Y

,,, Values matched and decided

Y, x1E, x1234, xBEAD, vJoy Device, 0, 0, 0, {NULL}, {A5D8DC70-8DD7-11EB-8002-444553540000}, {A5D8DC70-8DD7-11EB-8002-444553540000}, Y, Y
